{
  "v": "pir-1.1",
  "top": "Example",
  "placements": [
    { "uid": "inst0", "inst": "inst0", "cell": "AND2", "x": 0, "y": 0, "z": 0, "rot": "R0" }
  ],
  "routes": [
    {
      "uid": "route0",
      "net": "n0",
      "segments": [
        {
          "kind": "DUST",
          "points": [
            { "x": 0, "y": 0, "z": 0 },
            { "x": 1, "y": 0, "z": 0 }
          ],
          "turns": 0,
          "vias": 0
        }
      ]
    }
  ]
}
